### ISSUE TITLE
PHP Fatal error:  Uncaught exception 'ErrorException' with message 'fwrite(): send of 19 bytes failed with errno=32 Broken pipe'

### ISSUE THREAD

**Issue by Domovenok** [php-amqplib/php-amqplib#398]
Hi !
When consumer works for long time, i get this message:
"PHP Fatal error:  Uncaught exception 'ErrorException' with message 'fwrite(): send of 19 bytes failed with errno=32 Broken pipe' in vendor/php-amqplib/php-amqplib/PhpAmqpLib/Wire/IO/StreamIO.php:281"

**Comment by ceineke** [comment]
The TCP connection was torn down because of no activity. Are you running HAProxy between your client and your broker?

**Comment by Domovenok** [comment]
I am running it without HAProxy. Here is my settings:
            connection_timeout: 3
            read_write_timeout: 3

            # requires php-amqplib v2.4.1+ and PHP5.4+
            keepalive: false

            # requires php-amqplib v2.4.1+
            heartbeat: 0

**Comment by AhmetS** [comment]
I am having a similar issue. Works in GoLang fine, but not in PHP with this library

PHP
```
18:19:44.487061 IP serverIp.5672 > clientIp.49536: Flags [P.], seq 545:561, ack 371, win 235, options [nop,nop,TS val 6245986 ecr 509457945], length 16
E..D..@.6.a.%..*
..%.(... v..H......7|.....
._Nb.]..................
18:19:44.487135 IP clientIp.49536 > serverIp.5672: Flags [.], ack 561, win 4095, options [nop,nop,TS val 509457958 ecr 6245986], length 0
E..4a.@.@...
..%%..*...(.H... v.....R1.....
.].&._Nb
18:19:49.471900 IP serverIp.5672 > clientIp.49536: Flags [P.], seq 561:569, ack 371, win 235, options [nop,nop,TS val 6247221 ecr 509457958], length 8
E..<..@.6.a.%..*
..%.(... v..H......S......
._S5.].&........
18:19:49.471951 IP clientIp.49536 > serverIp.5672: Flags [.], ack 569, win 4095, options [nop,nop,TS val 509462914 ecr 6247221], length 0
E..4..@.@.|o
..%%..*...(.H... v.....9......
.]..._S5
18:19:54.446384 IP serverIp.5672 > clientIp.49536: Flags [P.], seq 569:577, ack 371, win 235, options [nop,nop,TS val 6248471 ecr 509462914], length 8
E..<..@.6.a.%..*
..%.(... v..H......;N.....
._X..]..........
18:19:54.446449 IP clientIp.49536 > serverIp.5672: Flags [.], ack 577, win 4095, options [nop,nop,TS val 509467869 ecr 6248471], length 0
E..4.y@.@.h{
..%%..*...(.H... v.....!......
.]..._X.
18:19:59.668757 IP serverIp.5672 > clientIp.49536: Flags [R.], seq 577, ack 371, win 235, options [nop,nop,TS val 6249721 ecr 509467869], length 0
E..4..@.6.a.%..*
..%.(... v..H......+......
._\..]..
```

Go
```
18:16:39.213361 IP clientIp.49526 > serverIp.5672: Flags [P.], seq 238:246, ack 577, win 4096, options [nop,nop,TS val 509273638 ecr 6197170], length 8
E..<t.@.@..(
..%%..*.v.(WnceA.......J......
.Z.&.^..........
18:16:39.224256 IP serverIp.5672 > clientIp.49526: Flags [P.], seq 577:585, ack 246, win 235, options [nop,nop,TS val 6199670 ecr 509273638], length 8
E..<+.@.6.)W%..*
..%.(.vA...Wncm....OT.....
.^.v.Z.&........
18:16:39.224330 IP clientIp.49526 > serverIp.5672: Flags [.], ack 585, win 4095, options [nop,nop,TS val 509273648 ecr 6199670], length 0
E..4..@.@...
..%%..*.v.(WncmA.......I......
.Z.0.^.v
```

Looks like with the Go Version, the client initiates the heartbeat and the server responds with its own heartbeat. You can see the acknowledgements.

With the PHP library, the server initiates the heartbeat, the client sends a tcp ack, but no heartbeat of its own.

No HAProxy in our setup. But we are using heartbeats.

```
        $conn = Config::get("queue.connections.$connectionConfigKey");

        $vhost = '/';
        $insist = false;
        $loginMethod = 'AMQPLAIN';
        $loginResponse = null;
        $locale = 'en_GB';
        $context = null;
        $keepalive = true;
        $connectionTimeout = 3.0;
        $heartbeat = 5;
        $readWriteTimeout = $heartbeat * 2;

        $this->connection = new AMQPStreamConnection(
            $conn["host"], $conn["port"], $conn["user"], $conn["pass"], $vhost,  $insist, $loginMethod, $loginResponse, $locale, $connectionTimeout, $readWriteTimeout, $context, $keepalive, $heartbeat);

        $this->channel = $this->connection->channel();
```

**Comment by lukebakken** [comment]
Please try to reproduce this using the latest release (`2.7.0`). If the problem persists, re-open this issue and let us know. Thanks.
